{
  "$schema": "https://json-schema.org/draft/2020-12/schema",
  "$id": "https://agentic-automl.local/benchmark/suite-manifest.schema.json",
  "title": "BenchmarkSuiteManifest",
  "type": "object",
  "additionalProperties": false,
  "required": ["schemaVersion", "id", "lane", "entries"],
  "properties": {
    "schemaVersion": { "const": 1 },
    "id": { "type": "string" },
    "lane": { "type": "string", "minLength": 1 },
    "entries": {
      "type": "array",
      "minItems": 1,
      "items": {
        "type": "object",
        "additionalProperties": false,
        "required": ["datasetRef", "repetitions"],
        "properties": {
          "datasetRef": { "type": "string", "minLength": 1 },
          "repetitions": { "type": "integer", "minimum": 1 },
          "qualityGate": { "type": "object" }
        }
      }
    }
  }
}
